Tweet Date,Tweet Content,label_up5,label_up2,label_down5,label_down2,Close,label_up5_price,label_up2_price,label_down5_price,label_down2_price,RSI,ROC,Upper Barrier,Lower Barrier,Vertical Barrier,Label,Previous Label,group,Pred_Label,Pred_Conf
2015-01-03,in hitchhiker in hand miner bitcoin bitcoin mining module brand new avail to powered extender riser adapter card bitcoin hub bitcoin miner block hitchhiker in hand miner bitcoin mining half pound bitcoin copper bar digital currency currency commodity half pound bitcoin copper bar bullion to powered extender riser adapter card bitcoin bitcoin mining module brand new avail hitchhiker in hand miner bitcoin hitchhiker in hand miner bitcoin mining hub bitcoin miner block half pound bitcoin copper bar bullion to powered extender riser adapter card bitcoin the price of bitcoin is now at half pound bitcoin copper bar digital currency currency commodity bitcoin mining module brand new avail hitchhiker in hand miner bitcoin mining hub bitcoin miner block hitchhiker in hand miner bitcoin half pound bitcoin copper bar bullion to powered extender riser adapter card bitcoin half pound bitcoin copper bar digital currency currency commodity hub bitcoin miner block hitchhiker in hand miner bitcoin mining bitcoin mining module brand new avail hitchhiker in hand miner bitcoin half pound bitcoin copper bar bullion to powered extender riser adapter card bitcoin half pound bitcoin copper bar digital currency currency commodity bitcoin mining module brand new avail hitchhiker in hand miner bitcoin hub bitcoin,False,False,True,True,287.13,False,False,True,True,0.0,0.9887210730599549,295.7439,278.5161,5.0,Neutral,Neutral,3,Neutral,0.9416351914405823
2015-01-03,to fraud half pound bitcoin copper bar bullion to powered extender riser adapter card bitcoin bitcoin mining module brand new avail half pound bitcoin copper bar digital currency currency commodity hitchhiker in hand miner bitcoin hitchhiker in hand miner bitcoin mining hub bitcoin miner block to powered extender riser adapter card bitcoin half pound bitcoin copper bar bullion half pound bitcoin copper bar digital currency currency commodity hub bitcoin miner block hitchhiker in hand miner bitcoin hitchhiker in hand miner bitcoin mining bitcoin mining module brand new avail half pound bitcoin copper bar bullion to powered extender riser adapter card bitcoin half pound bitcoin copper bar digital currency currency commodity hub bitcoin miner block hitchhiker in hand miner bitcoin hitchhiker in hand miner bitcoin mining bitcoin mining module brand new avail half pound bitcoin copper bar bullion to powered extender riser adapter card bitcoin half pound bitcoin copper bar digital currency currency commodity hitchhiker in hand miner bitcoin mining hub bitcoin miner block hitchhiker in hand miner bitcoin bitcoin mining module brand new avail half pound bitcoin copper bar bullion to powered extender riser adapter card bitcoin hitchhiker in hand miner bitcoin mining bitcoin mining module brand new avail hitchhiker,False,False,True,True,287.13,False,False,True,True,0.0,0.9887210730599549,295.7439,278.5161,5.0,Neutral,Neutral,2,Neutral,0.9422329068183899
2015-01-03,bitcoin bitcoin mining module brand new avail post no bitcoin half pound bitcoin copper bar digital currency currency commodity to powered extender riser adapter card bitcoin half pound bitcoin copper bar bullion hub bitcoin miner block bitcoin mining module brand new avail hitchhiker in hand miner bitcoin mining hitchhiker in hand miner bitcoin half pound bitcoin copper bar digital currency currency commodity to powered extender riser adapter card bitcoin bitcoin mining module brand new avail hub bitcoin miner block hitchhiker in hand miner bitcoin mining half pound bitcoin copper bar bullion hitchhiker in hand miner bitcoin half pound bitcoin copper bar bullion to powered extender riser adapter card bitcoin hub bitcoin miner block domain bid btc bitcoin domain half pound bitcoin copper bar digital currency currency commodity hitchhiker in hand miner bitcoin hitchhiker in hand miner bitcoin mining bitcoin mining module brand new avail hitchhiker in hand miner bitcoin hitchhiker in hand miner bitcoin mining to powered extender riser adapter card bitcoin hub bitcoin miner block half pound bitcoin copper bar digital currency currency commodity bitcoin mining module brand new avail half pound bitcoin copper bar bullion half pound bitcoin copper bar digital currency currency commodity hub bitcoin miner block,False,False,True,True,287.13,False,False,True,True,0.0,0.9887210730599549,295.7439,278.5161,5.0,Neutral,Neutral,0,Neutral,0.9440637826919556
2015-01-03,network and digital currency via win doge free doge keno game bitcoin party technology cryptocurrency politics to send you bitcoin tip for collect bitcoin foundation way with it global policy counsel by ember via try at per btc buy bitcoin block chain will break free from bitcoin to power distributed bitcoin btc at really will not go to bitcoin because of and gaw bitcoin money politics cryptocurrency bitcoin site lifetime for early live profit buy sell bitcoin btc bitcoin may integrate bitcoin for parking via wa game changer for bitcoin mining thats with to bitcoin but the same to any new coin invention company stock product gold trust silver trust bitcoin to sell million coin police are investigating whether million bitcoin wa actually an business insider digital dough it game on bitcoin btc bitcoin current price btc bitcoin current price btc bitcoin whatever the mind of man can conceive and believe can achieve bitcoin mona doge only doge love hope to help thank you bitcoin wish list free bitcoin faucet in just up for early access to debit the world first bitcoin sign up here bitcoin to sell million coin on how to deliver torrent for with bitcoin rev to,False,False,True,True,287.13,False,False,True,True,0.0,0.9887210730599549,295.7439,278.5161,5.0,Neutral,Neutral,3,Neutral,0.9530577063560486
2015-01-03,en el silver btc bitcoin foundation way with it global policy counsel harper whose appointment a the bitcoin fou bitcoin livre thanks really lucky caught it it could have ended up one of those get used for mining bitcoin or bitcoin btc kraken via bitcoin receive up to free every hour bitcoin the bitcoin news world crypto network bitcoin bitcoin how my got hacked by via bitcoin bitcoin foundation way with it global policy counsel the dismissal of harper come a the bitcoin bitcoin invest in to create more bitcoin not to cash into fiat one bitcoin now worth high low market cap billion bitcoin good article bitcoin best analogy ever btc bitcoin btc bitcoin btc bitcoin to expand bitcoin experiment to global level global level global level via so the is this good or bad for bitcoin love hope to help thank you bitcoin wish list bitcoin and survival guide how to thrive in the new digital wild west of crypto to expand bitcoin experiment to global level global level bitcoin ago today the genesis block at today a in business insider new bitcoin foundation year end report the new bitcoin foundation year end address see more bitcoin cryptocurrency,False,False,True,True,287.13,False,False,True,True,0.0,0.0,295.7439,278.5161,5.0,Neutral,Neutral,2,Neutral,0.9533190727233887
2015-01-03,the bitcoin st bowl bitcoin wa the single worst investment of bitcoin price at year end bitcoin mike this year saw massive progress on one of the most pressing facing bitcoin security ask question why are scam so to bitcoin the answer is actually flattering bitcoin fin bitcoin lo el de total bitcoin btc kraken bitcoin best analogy ever bitcoin study no longer an actual democracy it an oligarchy bitcoin difficulty next estimate in day bitcoin btc market research global investment in biometric security will grow to billion by biometrics security bitcoin bitcoin hold fine wine police are investigating whether million bitcoin wa actually an business insider business digital dough it game on inside bitcoin new tech stock bitcoin seeking alpha technology like bitcoin fraud press cryptocurrency bitcoin perdu la de sa valeur en current price btc bitcoin current price btc bitcoin current price btc bitcoin who about don waste time with bitcoin btc or doge only doge crypto empire via bitcoin bitcoin star donna dead at live profit buy sell bitcoin btc for virtual reality bitcoin da bitcoin btc crypto so is set to expand bitcoin experimentation nice crypto empire bitcoin will be the global banking order circle just,False,False,True,True,287.13,False,False,True,True,0.0,0.9887210730599549,295.7439,278.5161,5.0,Neutral,Neutral,0,Neutral,0.9505484104156494
2015-01-03,in hand miner bitcoin mining to powered extender riser adapter card bitcoin hub bitcoin miner block half pound bitcoin copper bar digital currency currency commodity bitcoin mining module brand new avail half pound bitcoin copper bar bullion half pound bitcoin copper bar digital currency currency commodity hub bitcoin miner block to powered extender riser adapter card bitcoin hitchhiker in hand miner bitcoin mining hitchhiker in hand miner bitcoin bitcoin mining module brand new avail hub bitcoin miner block may soon accept bitcoin and apple pay for parking half pound bitcoin copper bar digital currency currency commodity to powered extender riser adapter card bitcoin bitcoin mining module brand new avail hitchhiker in hand miner bitcoin mining hitchhiker in hand miner bitcoin half pound bitcoin copper bar bullion bitcoin mining module brand new avail hitchhiker in hand miner bitcoin mining to powered extender riser adapter card bitcoin hub bitcoin miner block half pound bitcoin copper bar digital currency currency commodity hitchhiker in hand miner bitcoin hitchhiker in hand miner bitcoin mining half pound bitcoin copper bar digital currency currency commodity hub bitcoin miner block half pound bitcoin copper bar bullion to powered extender riser adapter card bitcoin het het van via bitcoin,False,False,True,True,287.13,False,False,True,True,0.0,0.9887210730599549,295.7439,278.5161,5.0,Neutral,Neutral,4,Neutral,0.9467701315879822
2015-01-03,currency currency commodity hitchhiker in hand miner bitcoin mining hub bitcoin miner block hitchhiker in hand miner bitcoin bitcoin mining module brand new avail half pound bitcoin copper bar bullion to powered extender riser adapter card bitcoin hitchhiker in hand miner bitcoin mining bitcoin mining module brand new avail hitchhiker in hand miner bitcoin half pound bitcoin copper bar digital currency currency commodity hub bitcoin miner block half pound bitcoin copper bar bullion to powered extender riser adapter card bitcoin hitchhiker in hand miner bitcoin hitchhiker in hand miner bitcoin mining bitcoin mining module brand new avail half pound bitcoin copper bar digital currency currency commodity hub bitcoin miner block half pound bitcoin copper bar bullion to powered extender riser adapter card bitcoin hitchhiker in hand miner bitcoin mining half pound bitcoin copper bar digital currency currency commodity bitcoin mining module brand new avail hub bitcoin miner block hitchhiker in hand miner bitcoin to powered extender riser adapter card bitcoin hitchhiker in hand miner bitcoin mining hitchhiker in hand miner bitcoin half pound bitcoin copper bar bullion hub bitcoin miner block bitcoin mining module brand new avail half pound bitcoin copper bar bullion to powered extender riser adapter card bitcoin,False,False,True,True,287.13,False,False,True,True,0.0,0.9887210730599549,295.7439,278.5161,5.0,Neutral,Neutral,3,Neutral,0.9421004056930542
2015-01-03,block half pound bitcoin copper bar digital currency currency commodity half pound bitcoin copper bar bullion hub bitcoin miner block bitcoin mining module brand new avail hitchhiker in hand miner bitcoin hitchhiker in hand miner bitcoin mining half pound bitcoin copper bar bullion half pound bitcoin copper bar digital currency currency commodity bitcoin mining module brand new avail to powered extender riser adapter card bitcoin hub bitcoin miner block hitchhiker in hand miner bitcoin hitchhiker in hand miner bitcoin mining half pound bitcoin copper bar digital currency currency commodity half pound bitcoin copper bar bullion to powered extender riser adapter card bitcoin hub bitcoin miner block bitcoin mining module brand new avail hitchhiker in hand miner bitcoin mining hitchhiker in hand miner bitcoin half pound bitcoin copper bar digital currency currency commodity to powered extender riser adapter card bitcoin hitchhiker in hand miner bitcoin mining half pound bitcoin copper bar bullion hitchhiker in hand miner bitcoin hub bitcoin miner block bitcoin mining module brand new avail hitchhiker in hand miner bitcoin half pound bitcoin copper bar bullion half pound bitcoin copper bar digital currency currency commodity to powered extender riser adapter card bitcoin hub bitcoin miner block hitchhiker in hand,False,False,True,True,287.13,False,False,True,True,0.0,0.9887210730599549,295.7439,278.5161,5.0,Neutral,Neutral,4,Neutral,0.9445466995239258
2015-01-03,bullion hitchhiker in hand miner bitcoin hub bitcoin miner block bitcoin mining module brand new avail hitchhiker in hand miner bitcoin half pound bitcoin copper bar bullion half pound bitcoin copper bar digital currency currency commodity to powered extender riser adapter card bitcoin hub bitcoin miner block hitchhiker in hand miner bitcoin mining bitcoin mining module brand new avail half pound bitcoin copper bar bullion to powered extender riser adapter card bitcoin hitchhiker in hand miner bitcoin half pound bitcoin copper bar digital currency currency commodity hitchhiker in hand miner bitcoin mining hub bitcoin miner block hub bitcoin miner block bitcoin mining module brand new avail half pound bitcoin copper bar bullion to powered extender riser adapter card bitcoin half pound bitcoin copper bar digital currency currency commodity hitchhiker in hand miner bitcoin mining hitchhiker in hand miner bitcoin half pound bitcoin copper bar bullion to powered extender riser adapter card bitcoin hitchhiker in hand miner bitcoin mining half pound bitcoin copper bar digital currency currency commodity hitchhiker in hand miner bitcoin hub bitcoin miner block bitcoin mining module brand new avail en el bitcoin posted in si half pound bitcoin copper bar bullion hitchhiker in hand miner bitcoin hub,False,False,True,True,287.13,False,False,True,True,0.0,0.9887210730599549,295.7439,278.5161,5.0,Neutral,Neutral,0,Neutral,0.9416183829307556
2015-01-03,card bitcoin hitchhiker in hand miner bitcoin mining half pound bitcoin copper bar digital currency currency commodity hitchhiker in hand miner bitcoin hub bitcoin miner block bitcoin mining module brand new avail en el bitcoin posted in si half pound bitcoin copper bar bullion hitchhiker in hand miner bitcoin hub bitcoin miner block half pound bitcoin copper bar digital currency currency commodity to powered extender riser adapter card bitcoin bitcoin mining module brand new avail hitchhiker in hand miner bitcoin mining half pound bitcoin copper bar digital currency currency commodity half pound bitcoin copper bar bullion to powered extender riser adapter card bitcoin hitchhiker in hand miner bitcoin hub bitcoin miner block bitcoin mining module brand new avail half pound bitcoin copper bar bullion whispering pay bitcoin or work to bring bitcoin to middle east crypto bitcoin police are investigating whether million bitcoin wa actually an bitcoin mining attack when study bitcoin mining attack when study btc bitcoin current price btc bitcoin current price btc bitcoin btc out to the by in the past bitcoin the rise and rise of bitcoin instant video newly tagged bitcoin sell it beginning to look like an insider job bitcoin war e may soon,False,False,True,True,287.13,False,False,True,True,0.0,0.9887210730599549,295.7439,278.5161,5.0,Neutral,Neutral,2,Neutral,0.9454688429832458
2015-01-03,study bitcoin mining attack when study btc bitcoin current price btc bitcoin current price btc bitcoin btc out to the by in the past bitcoin the rise and rise of bitcoin instant video newly tagged bitcoin sell it beginning to look like an insider job bitcoin war e may soon accept bitcoin and apple pay for parking bitcoin bitcoin faucet just up for free bitcoin wallet on try it we welcome bitcoin to la in bitcoin price in buy sell buy and sell bitcoin in bitcoin is becoming to send use and more costly to mine maintain test your luck and win up to worth of free bitcoin every hour offering bitcoin bounty for information on gaw bitcoin extension de la distribution new york city considering apple pay bitcoin a for parking ticket payment bitcoin mining attack when study only per btc buy bitcoin the bitcoin billionaire digital dough it game on bitcoin btc bitcoin this is why love tipping where do you see the biggest impact of bitcoin bitcoin volatility index to be by but why use when you can use on excellent exchange it place we need more bitcoin newspaper bold claim about giant bitcoin loss naked security,False,False,True,True,287.13,False,False,True,True,0.0,0.9887210730599549,295.7439,278.5161,5.0,Neutral,Neutral,0,Neutral,0.9526677131652832
2015-01-03,game on bitcoin btc bitcoin this is why love tipping where do you see the biggest impact of bitcoin bitcoin volatility index to be by but why use when you can use on excellent exchange it place we need more bitcoin newspaper bold claim about giant bitcoin loss naked security read the taking the out of bitcoin in bitcoin mining attack when study colossus record bitcoin the is once again offer farewell corporate power how the rise of the in bitcoin could change everything via alternative en bitcoin win for free and he yours or bitcoin just up for free bitcoin wallet on try it bitcoin governor bitcoin for bitcoin bitcoin mining attack when study rip reconciler of religion and politics bitcoin index gold btc bitcoin price is btc bitcoin price few already in development that to see in the next bitcoin development are bitcoin casino poker good or bad thing for the u industry bitcoin alt coin tracker now supporting auld syne someday new research paper that bitcoin mining pool new research paper that new research paper that bitcoin mining pool new research paper that new research paper ar new research paper that new research paper that bitcoin mining,False,False,True,True,287.13,False,False,True,True,0.0,0.9887210730599549,295.7439,278.5161,5.0,Neutral,Neutral,1,Neutral,0.947486400604248
2015-01-03,thing for the u industry bitcoin alt coin tracker now supporting auld syne someday new research paper that bitcoin mining pool new research paper that new research paper that bitcoin mining pool new research paper that new research paper ar new research paper that new research paper that bitcoin mining pool bitcoin mining attack when study new research paper that bitcoin mining pool new research paper that new research paper that bitcoin mining pool bitcoin mining attack when study new research paper that bitcoin tech stock bitcoin seeking alpha via poker news weekly flop colossus record bitcoin follow u on for on new digital currency news and more bitcoin point bitcoin don miss out your bitcoin tip about to expire collect with this link only two on my topo becomes the first bitcoin company to feature in spot bitcoin bitcoin con el el el bitcoin el la se in bitcoin price in buy sell buy and sell bitcoin in mike how bitcoin technology advanced in insightful read on bitcoin and the theory of legal defence fund bitcoin weekly round up sell bitcoin bitcoin btc new post would the bitcoin make comeback in bitcoin for parking btc my problem with bitcoin,False,False,True,True,287.13,False,False,True,True,0.0,0.9887210730599549,295.7439,278.5161,5.0,Neutral,Neutral,3,Neutral,0.9426320791244507
2015-01-03,price in buy sell buy and sell bitcoin in mike how bitcoin technology advanced in insightful read on bitcoin and the theory of legal defence fund bitcoin weekly round up sell bitcoin bitcoin btc new post would the bitcoin make comeback in bitcoin for parking btc my problem with bitcoin and the only are the one bitcoin now worth high low market cap billion bitcoin follow our other account for latest bitcoin live price btc bitcoin current price btc bitcoin bitcoin bitcoin btc bitcoin la the current btc bitcoin value in is btc price current btc price on is volume btc bitcoin bitcoin difficulty next estimate in day erratic price matter bitcoin finance crypto via free bitcoin faucet now on an affordable loan example at btc win in the last there were exchange pair yielding ranging between and bitcoin btc bitcoin poker site to debut in eu with twist police suspect bitcoin theft wa an inside job chat will be huge for in and bitcoin will be successful this year make me want to go back to bitcoin to sell million coin gold trust bitcoin police are investigating whether million bitcoin wa actually an business insider talk and hardware bitcoin,False,False,True,True,287.13,False,False,True,True,0.0,0.9887210730599549,295.7439,278.5161,5.0,Neutral,Neutral,0,Neutral,0.9505763053894043
2015-01-03,pound bitcoin copper bar digital currency currency commodity hitchhiker in hand miner bitcoin hitchhiker in hand miner bitcoin mining half pound bitcoin copper bar digital currency currency commodity hub bitcoin miner block half pound bitcoin copper bar bullion to powered extender riser adapter card bitcoin het het van via bitcoin mining attack when study bitcoin mining module brand new avail hitchhiker in hand miner bitcoin half pound bitcoin copper bar digital currency currency commodity hub bitcoin miner block half pound bitcoin copper bar bullion to powered extender riser adapter card bitcoin hitchhiker in hand miner bitcoin mining bitcoin mining module brand new avail hitchhiker in hand miner bitcoin half pound bitcoin copper bar digital currency currency commodity half pound bitcoin copper bar bullion to powered extender riser adapter card bitcoin hitchhiker in hand miner bitcoin mining hitchhiker in hand miner bitcoin bitcoin mining module brand new avail hub bitcoin miner block half pound bitcoin copper bar digital currency currency commodity half pound bitcoin copper bar bullion hub bitcoin miner block bitcoin mining module brand new avail hitchhiker in hand miner bitcoin hitchhiker in hand miner bitcoin mining half pound bitcoin copper bar bullion half pound bitcoin copper bar digital currency,False,False,True,True,287.13,False,False,True,True,0.0,0.9887210730599549,295.7439,278.5161,5.0,Neutral,Neutral,2,Neutral,0.9448015093803406
2015-01-03,suspect bitcoin theft wa an inside job chat will be huge for in and bitcoin will be successful this year make me want to go back to bitcoin to sell million coin gold trust bitcoin police are investigating whether million bitcoin wa actually an business insider talk and hardware bitcoin mining bitcoin meriah de gratis via re bitcoin barcelona de la new way to earn bitcoin is bitcoin poised for success in vintage of the police are a relevant a ever hitchhiker in hand miner bitcoin mining an insider job bitcoin war bitcoin cryptocurrency tech japan bitcoin en bitcoin pioneer for over silk road en slate mi primer bitcoin wallet e en in just up for early access to debit the world first bitcoin sign up here tech stock bitcoin seeking alpha live profit buy sell bitcoin btc via submit for your consideration the former beef bowl which this year the bitcoin st bowl bitcoin wa the single worst investment of bitcoin price at year end bitcoin mike this year saw massive progress on one of the most pressing facing bitcoin security ask question why are scam so to bitcoin the answer is actually flattering bitcoin fin bitcoin lo el,False,False,True,True,287.13,False,False,True,True,0.0,0.9887210730599549,295.7439,278.5161,5.0,Neutral,Neutral,0,Neutral,0.9511231780052185
2015-01-03,time with bitcoin btc or doge only doge crypto empire via bitcoin bitcoin star donna dead at live profit buy sell bitcoin btc for virtual reality bitcoin da bitcoin btc crypto so is set to expand bitcoin experimentation nice crypto empire bitcoin will be the global banking order circle just won btc in our free lottery be our next winner bitcoin the application stack architecture bitcoin bitcoin via cryptocurrency is backed by real valuable profitable take invest in not in bitcoin or nan have you seen this yelp filter for bitcoin bitcoin request bitcoin police pay bitcoin ransom in the motley fool bitcoin price edging lower bitcoin police are investigating whether million bitcoin founder bitcoin can kill piracy via strengthening bitcoin easy buy the future to the moon bitcoin bitcoin watch is out via learning about bitcoin and finding it very interesting definitely going to try and bitcoin mining and trading at some point in how bitcoin could transform personal insurance security one bitcoin now worth high low market cap billion bitcoin fact bitcoin network speed in at and by end all of the combined one bitcoin now worth market cap billion based on bitcoin bitcoin btc bitcoin btc episode,False,False,True,True,287.13,False,False,True,True,0.0,0.9887210730599549,295.7439,278.5161,5.0,Neutral,Neutral,0,Neutral,0.9500052332878113
