Tweet Date,Tweet Content,label_up5,label_up2,label_down5,label_down2,Close,label_up5_price,label_up2_price,label_down5_price,label_down2_price,RSI,ROC,Upper Barrier,Lower Barrier,Vertical Barrier,Label,Previous Label,group,Pred_Label,Pred_Conf
2015-01-03,to bitcoin vote on for gaw bitcoin wealth alliance btc bitcoin can you please tell me what or thing you use to play poker for real money current price btc bitcoin current price btc bitcoin doge only doge legal un en bitcoin this guy just understand bitcoin receive up to free every hour bitcoin via new wearable kind of year bitcoin the year in bitcoin in two bitcoin digital currency to another mobile currency bitcoin integration and the future of digital currency adoption bitcoin cryptocurrency insurance bitcoin sent you to claim them on virtual currency bitcoin respect for currency business post no bitcoin na para no valor de de suspect bitcoin robbery an inside job virtual currency bitcoin respect for currency business today on bitcoin gaw bitcoin loss from now thought to be fraud by bitcoin bitcoin cryptocurrency trading news bitcoin remain directionless community board bitcoin block party out on campaign to dismantle bitcoin foundation value make your best year yet and apply to boost bitcoin only tribe today is the last day to apply bitcoin ser bien un de con bitcoin unit to bitcoin digital dough it game on un en el no visa para en auld syne someday,False,False,True,True,287.13,False,False,True,True,0.0,0.9887210730599549,295.7439,278.5161,5.0,Neutral,Neutral,0,Neutral,0.947044312953949
2015-01-03,campaign to dismantle bitcoin foundation value make your best year yet and apply to boost bitcoin only tribe today is the last day to apply bitcoin ser bien un de con bitcoin unit to bitcoin digital dough it game on un en el no visa para en auld syne someday social medium mobile print bitcoin loan to bitcoin from due in day from this transaction bitcoin nothing public yet but some more exciting bitcoin stuff is coming a soon a and that just the tip of the iceberg de van bitcoin is lee over het geld van morgen bitcoin btc bitcoin instantly buy with btc police close in on collapse police suspect bitcoin theft wa an inside job auto copy trade free at auto copy trade free at happy new year here is bitcoin tip via claim it here community board bitcoin block party value newspaper bold claim about giant bitcoin loss at financial cross and practical solution could be bitcoin just won btc in our free lottery win free btc now bitcoin police are investigating whether million bitcoin wa actually an inside job social gaming platform with bitcoin integration and gift card from top out on campaign to dismantle,False,False,True,True,287.13,False,False,True,True,0.0,0.9887210730599549,295.7439,278.5161,5.0,Neutral,Neutral,1,Neutral,0.9451681971549988
2015-01-03,bitcoin loss at financial cross and practical solution could be bitcoin just won btc in our free lottery win free btc now bitcoin police are investigating whether million bitcoin wa actually an inside job social gaming platform with bitcoin integration and gift card from top out on campaign to dismantle bitcoin foundation price for btc in btc you can buy for bitcoin bitcoin magazine via out on campaign to dismantle bitcoin foundation government sale of bitcoin fungibility precedent please help test only some very exciting bitcoin cryptocurrency bitcoin not yet entirely anonymous group of other genesis my husband and have an open marriage police are investigating whether million bitcoin wa actually an inside job via barry to institutional bitcoin exchange the most important the economy you see this year via bitcoin cryptocurrency bitcoin miracle if you had bought btc last you would be millionaire today bitcoin miracle if you had bought btc last you would be millionaire today police are investigating whether million bitcoin wa actually an inside job bitcoin magazine via my best this week came from via live profit buy sell bitcoin btc fin de la propaganda gold bitcoin another bitcoin loan is available get interest from new,False,False,True,True,287.13,False,False,True,True,0.0,0.9887210730599549,295.7439,278.5161,5.0,Neutral,Neutral,4,Neutral,0.9472869634628296
2015-01-03,bought btc last you would be millionaire today police are investigating whether million bitcoin wa actually an inside job bitcoin magazine via my best this week came from via live profit buy sell bitcoin btc fin de la propaganda gold bitcoin another bitcoin loan is available get interest from new bitcoin btc only have think the money wa lost in probably got turned into bitcoin by now let just call it even in the last there were exchange pair yielding ranging between and bitcoin btc bought auto copy trade free at get it is free to bitcoin bitcoin business insider police are investigating whether million bitcoin wa company to accept bitcoin via sai bitcoin out on campaign to dismantle bitcoin foundation he bitcoin checker for android wonder what the top ten in each state were bet bitcoin would be on number of other edition new bitcoin server police suspect bitcoin robbery wa mainly an inside job bitcoin turned human trust into an information science it to be immutably into try at only per btc buy bitcoin current price btc bitcoin current price btc bitcoin current price btc bitcoin two for bitcoin and one for net neutrality how start are embracing,False,False,True,True,287.13,False,False,True,True,0.0,0.9887210730599549,295.7439,278.5161,5.0,Neutral,Neutral,3,Neutral,0.9510530233383179
2015-01-03,robbery wa mainly an inside job bitcoin turned human trust into an information science it to be immutably into try at only per btc buy bitcoin current price btc bitcoin current price btc bitcoin current price btc bitcoin two for bitcoin and one for net neutrality how start are embracing bitcoin police are investigating whether million bitcoin wa actually an inside job value bitcoin buy and sell bitcoin instantly from anywhere in the world to explain why it five year exponential trend will suddenly end haven you been betting at bitcoin dont have bitcoin your safe haven while shopping for food and ammo bitcoin index pizza btc out on campaign to dismantle bitcoin foundation out on via what on your list top technology of via glass bitcoin more brave new world bitcoin cryptocurrency bitcoin wa actually an inside job are good for bitcoin because they are to great by external bitcoin bitcoin btc about don waste time with bitcoin btc or the community cryptocurrency crypto bitcoin bitcoin re giveaway round hope to see mobile or tablet technology advanced in bitcoin de brave new coin on your bitcoin vision and relentless push toward partner way to measure the bitcoin network health,False,False,True,True,287.13,False,False,True,True,0.0,0.9887210730599549,295.7439,278.5161,5.0,Neutral,Neutral,1,Neutral,0.9488274455070496
2015-01-03,news channel community board bitcoin block party the digital dough it game on bitcoin bowl see tech big picture but few in coin news out on campaign to dismantle bitcoin foundation in coin news cheap and secure lizard squad selling via bitcoin win doge free doge keno game en magazine in just up for early access to debit the world first bitcoin sign up here bitcoin community board bitcoin block party bitcoin btc at this time more than ever before that the bitcoin community is to auld syne someday how to avoid bitcoin in auld syne someday bitcoin bitcoin by in live price bitcoin bitcoin by in live price for virtual reality bitcoin in just up for early access to debit the world first bitcoin sign up here value week to week news quiz for sur cause de bitcoin why doe bitcoin take over and know who that is thanks to bitcoin vote on for gaw bitcoin wealth alliance btc bitcoin can you please tell me what or thing you use to play poker for real money current price btc bitcoin current price btc bitcoin doge only doge legal un en bitcoin this guy just understand bitcoin receive up to,False,False,True,True,287.13,False,False,True,True,0.0,0.9887210730599549,295.7439,278.5161,5.0,Neutral,Neutral,0,Neutral,0.9516828060150146
2015-01-03,conference because of one controversial speaker via bitcoin in just up for early access to debit the world first bitcoin sign up here police suspect bitcoin theft wa an inside job when is kind of money the future of the bitcoin ecosystem and trustless trust why in bitcoin actual e don miss out your bitcoin tip about to expire collect with this link get everything you need no charge and bitcoin the first bitcoin only we do have bitcoin black white anyone want me to grill at the conference from to gaw bitcoin bitcoin not yet entirely anonymous decent today article about the rise of crypto out on campaign to dismantle bitcoin foundation digital dough bitcoin may soon accept bitcoin and for parking an inside job not alone new bitcoin career developer bitcoin police suspect bitcoin robbery wa mainly an inside job for virtual reality bitcoin de de bitcoin e de el another day beautiful day at bitcoin poker forum casino bonus money morning bitcoin to sell million coin bitcoin out on campaign to dismantle bitcoin foundation nearly all lost to fraud not bitcoin bitcoin out on campaign to dismantle bitcoin foundation money morning bitcoin to sell million coin stile,False,False,True,True,287.13,False,False,True,True,0.0,0.9887210730599549,295.7439,278.5161,5.0,Neutral,Neutral,1,Neutral,0.9447121024131775
2015-01-03,via chain earn free bitcoin just by leaving browser tab open invite only stock our simple and easy to use bitcoin retail bitcoin la out on campaign to dismantle bitcoin foundation sorry hiccup with last tweet here title and link for virtual reality bitcoin how one to reimagine bitcoin one bitcoin now worth high low market cap billion bitcoin bitcoin bitcoin btc btc bitcoin favorable bitcoin btc bitcoin the average price of bitcoin across all is current price btc bitcoin instantly buy with btc via new post police are investigating whether million bitcoin wa actually an inside job sell holiday to minimize coverage of still in triangle but not sure how valid it is an tech stock bitcoin seeking alpha job legal defence fund bitcoin ben to decide on presidential run by may now u pay with bitcoin time of bitcoin index pizza btc police are investigating whether million bitcoin wa actually an inside job po bitcoin mine more than never post on they can be used to launch mining bitcoin regulation will influence expansion air wuther million bitcoin an inside job police suspect fraud took most of missing fell consistently over the year to what is right now try,False,False,True,True,287.13,False,False,True,True,0.0,0.9887210730599549,295.7439,278.5161,5.0,Neutral,Neutral,2,Neutral,0.9501361846923828
2015-01-03,wa actually an inside job po bitcoin mine more than never post on they can be used to launch mining bitcoin regulation will influence expansion air wuther million bitcoin an inside job police suspect fraud took most of missing fell consistently over the year to what is right now try at only per btc buy bitcoin bitcoin apple pay for parking win bitcoin every hour no attached mike how bitcoin technology advanced in please don boycott an entire industry conference because of one controversial speaker lizard squad selling via bitcoin via mosque in the wake of arson a anonymous a you thought bitcoin la digital ha al study how bitcoin could transform personal insurance in the last there were exchange pair yielding ranging between and bitcoin btc police are investigating whether million bitcoin wa actually an inside job police are investigating whether million bitcoin wa actually an inside job police are investigating whether million bitcoin wa actually an inside job bitcoin taxation gift from the the coffee problem wall street technology via bitcoin missing bitcoin update video post no bitcoin galera valor ideal para fee btc u bitcoin and survival guide how to thrive in the new digital wild west,False,False,True,True,287.13,False,False,True,True,0.0,0.9887210730599549,295.7439,278.5161,5.0,Neutral,Neutral,4,Neutral,0.9445198178291321
2015-01-03,are investigating whether million bitcoin wa actually an inside job bitcoin taxation gift from the the coffee problem wall street technology via bitcoin missing bitcoin update video post no bitcoin galera valor ideal para fee btc u bitcoin and survival guide how to thrive in the new digital wild west of crypto bitcoin faucet police are investigating whether million bitcoin wa actually an inside job bitcoin in just up for early access to debit the world first bitcoin sign up here bitcoin apple pay la di non ha by via police are investigating whether million bitcoin wa actually an inside job en el bitcoin don miss out your bitcoin tip about to expire collect with this link en el bitcoin en el bitcoin posted in en el bitcoin en el bitcoin posted in si to be working on slack integration via bitcoin re not going to so am going to be positive and engage with them instead bitcoin first campaign to promote bitcoin btc cryptocurrency in bitcoin price in buy sell buy and sell bitcoin in bitcoin news study how bitcoin could transform personal insurance in just up for early access to debit the world first bitcoin sign up here,False,False,True,True,287.13,False,False,True,True,0.0,0.9887210730599549,295.7439,278.5161,5.0,Neutral,Neutral,1,Neutral,0.9526792764663696
2015-01-03,be positive and engage with them instead bitcoin first campaign to promote bitcoin btc cryptocurrency in bitcoin price in buy sell buy and sell bitcoin in bitcoin news study how bitcoin could transform personal insurance in just up for early access to debit the world first bitcoin sign up here on excellent exchange it place we need more bitcoin bitcoin btc bitcoin btc good reading think we were this while ago live profit buy sell bitcoin btc bitcoin the one year anniversary of the project bitcoin and slack bitcoin yearly review bitcoin video bitcoin question why are scam so to bitcoin business police are investigating whether million bitcoin wa actually an inside job bitcoin faucet police suspect bitcoin robbery wa mainly an inside job nearly year since the now defunct an inside job btc cryptocurrency cryptocurrency exchange platform it never been so easy to use bitcoin via cheap and secure via bitcoin btc bitcoin current price btc bitcoin current price btc bitcoin bitcoin could rise significantly in a around the world and oil continue to weaken hyper market is now coming bitcoin bitcoin la digital ha al bitcoin tweet news bitcoin news mike how bitcoin technology advanced in video video,False,False,True,True,287.13,False,False,True,True,0.0,0.9887210730599549,295.7439,278.5161,5.0,Bearish,Neutral,3,Neutral,0.9480298757553101
2015-01-03,via bitcoin btc bitcoin current price btc bitcoin current price btc bitcoin bitcoin could rise significantly in a around the world and oil continue to weaken hyper market is now coming bitcoin bitcoin la digital ha al bitcoin tweet news bitcoin news mike how bitcoin technology advanced in video video zero confirmation safe via bitcoin oh last thing market cap is pointless metric the list by volume is informative to launch bitcoin fear index btc cryptocurrency bitcoin an inside job not alone auto copy trade free at en el bitcoin btc in on that market but not bad for an outright scam sorry to be wet blanket writing description for bitcoin for general is bloody en el bitcoin posted in si en el bitcoin posted in si newly added police suspect bitcoin robbery wa mainly an inside job en el bitcoin posted in si en el bitcoin en el bitcoin en el bitcoin posted in en el bitcoin en el bitcoin bitcoin effective immediately we re permanently increasing daily doge by bitcoin just won btc in our free lottery let have some fun bitcoin out on campaign to dismantle bitcoin foundation cryptocurrency innovation bitcoin bitcoin index silver btc sorry to,False,False,True,True,287.13,False,False,True,True,0.0,0.9887210730599549,295.7439,278.5161,5.0,Bearish,Bearish,0,Neutral,0.9507206678390503
2015-01-03,en el bitcoin posted in en el bitcoin en el bitcoin bitcoin effective immediately we re permanently increasing daily doge by bitcoin just won btc in our free lottery let have some fun bitcoin out on campaign to dismantle bitcoin foundation cryptocurrency innovation bitcoin bitcoin index silver btc sorry to be wet blanket writing description for bitcoin for general is bloody out on campaign to dismantle bitcoin foundation only per btc buy bitcoin bitcoin wealth alliance question why are scam so to bitcoin out on campaign to dismantle bitcoin foundation bitcoin and slack bitcoin out on campaign to dismantle bitcoin foundation bitcoin missing likely an inside job say police in the last there were exchange pair yielding ranging between and bitcoin btc bitcoin why doe the bitcoin community mistrust josh bitcoin casino play now over btc in poker more super en el bitcoin posted in en el bitcoin bitcoin bowl see tech big picture but few instant event system how to turn any event into money maker for your school bitcoin the bitcoin creator found college ser en te mike how bitcoin technology advanced in insider tat just won btc in our free lottery you have daily bitcoin campaign first,False,False,True,True,287.13,False,False,True,True,0.0,0.9887210730599549,295.7439,278.5161,5.0,Bearish,Bearish,4,Neutral,0.9497082829475403
2015-01-03,free here price to ring in the new year giant bitcoin loss naked security japan based the north bitcoin conference is the bitcoin on earth catch u at big thanks to army for keeping to the truth and warning new about and gaw some tech stock bitcoin the virtual reality will eventually live profit buy sell bitcoin btc current price of bitcoin is another it at have you your free bitcoin today en el bitcoin bitcoin digital bitcoin are legal for in bitcoin bitcoin apple pay a to pay parking you can buy an increasing number of good of what the financial elite say about bitcoin just received copy of the world first bitcoin card deck a the joker and many en el bitcoin we are always looking for great bitcoin if you are or journalist writing about out on campaign to dismantle bitcoin foundation current price of bitcoin is via chain earn free bitcoin just by leaving browser tab open invite only stock our simple and easy to use bitcoin retail bitcoin la out on campaign to dismantle bitcoin foundation sorry hiccup with last tweet here title and link for virtual reality bitcoin how one to reimagine bitcoin one,False,False,True,True,287.13,False,False,True,True,0.0,0.9887210730599549,295.7439,278.5161,5.0,Bearish,Bearish,1,Neutral,0.9459403157234192
2015-01-03,mining bitcoin to mine history in the making duplicitas bitcoin have shown that many have family truth to my gay duplicitas the worst of bitcoin wa the single worst investment of from only per btc buy bitcoin bitcoin revolution do you know there is financial revolution going on under your very nose bitcoin and survival guide how to thrive in the new digital wild west of crypto fair btc gambling via live profit buy sell bitcoin btc jota bitcoin out on campaign to dismantle bitcoin foundation and you want me to put my money on the new york buy your steam there index btc earn bitcoin advertising bitcoin out on campaign to dismantle bitcoin foundation via bitcoin for parking the worst of bitcoin wa the single worst investment of from high insurance and you want me to put my money on the hacked bitcoin for parking inside job tech stock bitcoin btc bitcoin current price btc bitcoin current price btc bitcoin out on campaign to dismantle bitcoin foundation anarchist his can gazzetta bitcoin bitcoin di bitcoin free btc every no catch bitcoin share free advertising bitcoin and other of the worst of cheap with bitcoin video en el bitcoin si,False,False,True,True,287.13,False,False,True,True,0.0,0.9887210730599549,295.7439,278.5161,5.0,Bearish,Bearish,3,Neutral,0.9443348050117493
2015-01-04,an issue of supply and demand though and no one is demanding and the paradox the gold standard replace gold with bitcoin seen the logic previously in early jeff on the crypto show in capitalism bitcoin monopoly and more cryptocurrency news bitcoin betting via bitcoin price below bitcoin bitcoin next bitcoin difficulty increase by while price to one bitcoin now worth high low market cap billion bitcoin one bitcoin now worth market cap billion based on bitcoin newspaper bold claim about giant bitcoin loss bitcoin btc bitcoin price below bitcoin bitcoin btc bit coin mining contract daily bitcoin have to raise fund but which hedge fund you to hate bitcoin local bitcoin medium outlet is our latest official partner look for them at our bitcoin price below peter about the future of bitcoin in cryptocurrency news think we will return to the price zone the true bitcoin value before mark blurred the market we were before honestly less energy use while we are out what bitcoin is usual for bitcoin looking like it will bottom out in the range around the week of this month then we should see bounce btc ltc sell your bitcoin btc before crash protect your,False,False,True,True,264.72,False,False,True,True,0.0,0.122477631217212,272.6616,256.77840000000003,5.0,Neutral,Bearish,1,Neutral,0.9508554935455322
2015-01-04,buy and sell bitcoin in had the best response to of her nye performance el bitcoin bitcoin how to make dollar after dollar after dollar with via cryptocurrency now cryptocurrency for and related bitcoin governor bitcoin for via bitcoin no patamar do u de fraud post no bitcoin is out it own crypto currency and the exciting and receive up to free every hour bitcoin via challenge to get free in one day one day get free bitcoin dragon age super smash shovel knight city rampage bitcoin millionaire destiny genus con bitcoin registrate para de mi wont bounce much after so long for virtual reality bitcoin god and some dude drive filled with like million of bitcoin if find that sh crypto in turning bitcoin theory into big business while last year saw lot of over crypto bitcoin becomes legal tender for in via bitcoin economist tucker are bullish for bitcoin via crypto in turning bitcoin theory into big business gold btc governor bitcoin for bitcoin crypto marketing is now in the know watch out for these they love high fee bitcoin crypto in turning bitcoin theory into big business bit crypto industry massive to crypto in turning bitcoin theory,False,False,True,True,264.72,False,False,True,True,0.0,0.9887210730599549,272.6616,256.77840000000003,5.0,Neutral,Neutral,0,Neutral,0.9507546424865723
2015-01-04,in the last there were exchange pair yielding ranging between and bitcoin btc not against bitcoin just think check this out for free bitcoin and price going to win every wager today and still lose money at bitcoin book because led digital about to be worthless blest said bitcoin is not illegal good news right why doe the price take hit with every good news fascinating world of bitcoin china dumping into it is great time to be alive bitcoin a bitcoin spin from one of the faithful price is not important unless of course you own some the digital asset world is waking up to the fact that despite it name bitcoin is not really currency at all dumping to save negro josh speech at the north bitcoin conference in coming up on no don take bitcoin for or for world circle froze my account only after my deposit wa just like again the genesis of bitcoin bitcoin will go up or down in coming day when it will hit bitcoin no fundamental bitcoin price below bitcoin like prince bitcoin happy birthday bitcoin bitcoin the price of bitcoin while the bitcoin bubble is and the crypto are weeping per,False,False,True,True,264.72,False,False,True,True,0.0,0.122477631217212,272.6616,256.77840000000003,5.0,Neutral,Neutral,4,Neutral,0.9478583335876465
2015-01-04,wa just like again the genesis of bitcoin bitcoin will go up or down in coming day when it will hit bitcoin no fundamental bitcoin price below bitcoin like prince bitcoin happy birthday bitcoin bitcoin the price of bitcoin while the bitcoin bubble is and the crypto are weeping per btc is not bad to buy some post no bitcoin bom by via bitcoin without how poker is my favorite sport always in the top two at bitcoin index pizza btc how the top of prepared u for the new year bitcoin circle froze my account only after my deposit wa just like again bitcoin ben bitcoin to the early day of the re again free service like done better than the physical bitcoin next bitcoin difficulty increase by while price to via bitcoin bitcoin the first bitcoin only bitcoin this is disaster bitcoin price under u how low will it go don like the to become smug bitcoin is just amazing drama in all even with all that drama it is also so clearly pointing to our future fascinating don miss out your bitcoin tip about to expire collect with this link russia to play host to first ever,False,False,True,True,264.72,False,False,True,True,0.0,0.122477631217212,272.6616,256.77840000000003,5.0,Neutral,Neutral,1,Neutral,0.9476850628852844
